### ISSUE TITLE
Syslog-ng losing messages due to possible connection issue

### ISSUE THREAD

**Issue by derosm2** [balabit/syslog-ng#1341]
# syslog-ng

## Version of syslog-ng

```
syslog-ng 3.5.6
Installer-Version: 3.5.6
Revision: 3.5.6-2.1 [@416d315] (Ubuntu/16.04)
Compile-Date: Oct 24 2015 03:49:19
Available-Modules: afsocket-tls,basicfuncs,syslogformat,afsocket,dbparser,afsocket-notls,csvparser,confgen,linux-kmsg-format,afprog,cryptofuncs,system-source,affile,afuser
Enable-Debug: off
Enable-GProf: off
Enable-Memtrace: off
Enable-IPv6: on
Enable-Spoof-Source: on
Enable-TCP-Wrapper: on
Enable-Linux-Caps: on
Enable-Pcre: on
```

## Platform

Ubuntu/16.04

# Issue
Logs go missing for extended periods of time (over half an hour)
## Failure
Using tcpdump, I can see that that loggly's servers send an F flag, but then syslog-ng continues to attempt to push data and gets no response back from the server.

```
18:51:25.146326 IP jobs2.localdomain.40627 > logglyip.syslog-tls: Flags [.], ack 1773748437, win 282, options [nop,nop,TS val 2060157056 ecr 446836019], length 0
18:51:25.147393 IP logglyip.syslog-tls > jobs2.localdomain.40627: Flags [.], ack 1, win 155, options [nop,nop,TS val 447092101 ecr 2059900973], length 0
18:54:20.817528 IP logglyip.syslog-tls > jobs2.localdomain.40627: Flags [P.], seq 1:32, ack 1, win 155, options [nop,nop,TS val 447136019 ecr 2059900973], length 31
18:54:20.835248 IP jobs2.localdomain.40627 > logglyip.syslog-tls: Flags [P.], seq 1:160, ack 32, win 282, options [nop,nop,TS val 2060200978 ecr 447136019], length 159
18:54:20.836443 IP logglyip.syslog-tls > jobs2.localdomain.40627: Flags [.], ack 160, win 164, options [nop,nop,TS val 447136024 ecr 2060200978], length 0
19:11:25.274352 IP jobs2.localdomain.40627 > logglyip.syslog-tls: Flags [.], ack 32, win 282, options [nop,nop,TS val 2060457088 ecr 447136024], length 0
19:11:25.275449 IP logglyip.syslog-tls > jobs2.localdomain.40627: Flags [.], ack 160, win 164, options [nop,nop,TS val 447392133 ecr 2060200978], length 0
19:14:20.842469 IP jobs2.localdomain.40627 > logglyip.syslog-tls: Flags [P.], seq 160:319, ack 32, win 282, options [nop,nop,TS val 2060500980 ecr 447392133], length 159
19:14:20.843575 IP logglyip.syslog-tls > jobs2.localdomain.40627: Flags [.], ack 319, win 172, options [nop,nop,TS val 447436025 ecr 2060500980], length 0
19:14:20.843746 IP logglyip.syslog-tls > jobs2.localdomain.40627: Flags [F.], seq 32, ack 319, win 172, options [nop,nop,TS val 447436025 ecr 2060500980], length 0
19:14:20.882341 IP jobs2.localdomain.40627 > logglyip.syslog-tls: Flags [.], ack 33, win 282, options [nop,nop,TS val 2060500990 ecr 447436025], length 0
19:31:24.890368 IP jobs2.localdomain.40627 > logglyip.syslog-tls: Flags [.], ack 33, win 282, options [nop,nop,TS val 2060756992 ecr 447436025], length 0
19:32:40.154337 IP jobs2.localdomain.40627 > logglyip.syslog-tls: Flags [.], ack 33, win 282, options [nop,nop,TS val 2060775808 ecr 447436025], length 0
19:33:55.418340 IP jobs2.localdomain.40627 > logglyip.syslog-tls: Flags [.], ack 33, win 282, options [nop,nop,TS val 2060794624 ecr 447436025], length 0
19:34:20.842685 IP jobs2.localdomain.40627 > logglyip.syslog-tls: Flags [P.], seq 319:478, ack 33, win 282, options [nop,nop,TS val 2060800980 ecr 447436025], length 159
19:34:21.046345 IP jobs2.localdomain.40627 > logglyip.syslog-tls: Flags [P.], seq 319:478, ack 33, win 282, options [nop,nop,TS val 2060801031 ecr 447436025], length 159
19:34:21.250349 IP jobs2.localdomain.40627 > logglyip.syslog-tls: Flags [P.], seq 319:478, ack 33, win 282, options [nop,nop,TS val 2060801082 ecr 447436025], length 159
19:34:21.658355 IP jobs2.localdomain.40627 > logglyip.syslog-tls: Flags [P.], seq 319:478, ack 33, win 282, options [nop,nop,TS val 2060801184 ecr 447436025], length 159
19:34:22.474349 IP jobs2.localdomain.40627 > logglyip.syslog-tls: Flags [P.], seq 319:478, ack 33, win 282, options [nop,nop,TS val 2060801388 ecr 447436025], length 159
19:34:24.110351 IP jobs2.localdomain.40627 > logglyip.syslog-tls: Flags [P.], seq 319:478, ack 33, win 282, options [nop,nop,TS val 2060801797 ecr 447436025], length 159
19:34:27.386342 IP jobs2.localdomain.40627 > logglyip.syslog-tls: Flags [P.], seq 319:478, ack 33, win 282, options [nop,nop,TS val 2060802616 ecr 447436025], length 159
19:34:33.930341 IP jobs2.localdomain.40627 > logglyip.syslog-tls: Flags [P.], seq 319:478, ack 33, win 282, options [nop,nop,TS val 2060804252 ecr 447436025], length 159
19:34:47.002348 IP jobs2.localdomain.40627 > logglyip.syslog-tls: Flags [P.], seq 319:478, ack 33, win 282, options [nop,nop,TS val 2060807520 ecr 447436025], length 159
19:35:13.178337 IP jobs2.localdomain.40627 > logglyip.syslog-tls: Flags [P.], seq 319:478, ack 33, win 282, options [nop,nop,TS val 2060814064 ecr 447436025], length 159
19:36:05.466352 IP jobs2.localdomain.40627 > logglyip.syslog-tls: Flags [P.], seq 319:478, ack 33, win 282, options [nop,nop,TS val 2060827136 ecr 447436025], length 159
19:37:50.170376 IP jobs2.localdomain.40627 > logglyip.syslog-tls: Flags [P.], seq 319:478, ack 33, win 282, options [nop,nop,TS val 2060853312 ecr 447436025], length 159
19:39:50.234350 IP jobs2.localdomain.40627 > logglyip.syslog-tls: Flags [P.], seq 319:478, ack 33, win 282, options [nop,nop,TS val 2060883328 ecr 447436025], length 159
19:41:50.554314 IP jobs2.localdomain.40627 > logglyip.syslog-tls: Flags [P.], seq 319:478, ack 33, win 282, options [nop,nop,TS val 2060913408 ecr 447436025], length 159
19:43:50.874330 IP jobs2.localdomain.40627 > logglyip.syslog-tls: Flags [P.], seq 319:478, ack 33, win 282, options [nop,nop,TS val 2060943488 ecr 447436025], length 159
19:45:51.194368 IP jobs2.localdomain.40627 > logglyip.syslog-tls: Flags [P.], seq 319:478, ack 33, win 282, options [nop,nop,TS val 2060973568 ecr 447436025], length 159
19:47:51.514340 IP jobs2.localdomain.40627 > logglyip.syslog-tls: Flags [P.], seq 319:478, ack 33, win 282, options [nop,nop,TS val 2061003648 ecr 447436025], length 159
```

Eventually syslog-ng connects to a different server and using verbose logging I see the following after some period of logs (over 20 minutes) have gone missing
```
Closing log transport fd; fd='7'
Syslog connection broken; fd='7', server='AF_INET(OLD-IP:6514)', time_reopen='60'
Syslog connection established; fd='7', server='AF_INET(NEW-IP:6514)', local='AF_INET(0.0.0.0:0)'
```

## Steps to reproduce
https://hub.docker.com/r/phusion/passenger-ruby22/

1. docker pull phusion/passenger-ruby22
2. sudo docker run -d --name loggly_test -e "RAILS_ENV=STAGING" -v /home/ec2-user/syslog-ng.conf:/etc/syslog-ng/syslog-ng.conf phusion/passenger-ruby22
3. leave container/container running and logging for an hour or so
4. send log statements via logger
- docker exec -it loggly_test bash
- logger 'testing a message from my container'
5. see if the log statements appear in loggly

## Configuration

```
@version: 3.5
@include "scl.conf"
@include "`scl-root`/system/tty10.conf"

# Syslog-ng configuration file, compatible with default Debian syslogd
# installation.

# First, set some global options.
options { chain_hostnames(off); flush_lines(0); use_dns(no); use_fqdn(no);
          owner("root"); group("adm"); perm(0640); stats_freq(600);
          bad_hostname("^gconfd$");
};

########################
# Sources
########################
# This is the default behavior of sysklogd package
# Logs may come from unix stream, but not from another machine.
#
source s_src {
       unix-stream("/dev/log");
       internal();
};

template LogglyFormat { template("<${PRI}>1 ${ISODATE} ${HOST} ${PROGRAM} ${PID} ${MSGID} [TOKEN@41058 ] $MSG\n");
        template_escape(no);
};

destination d_loggly {
     tcp("logs-01.loggly.com" port(6514)
          tls(peer-verify(required-untrusted) ca_dir('/opt/syslog-ng/keys/ca.d/'))
          template(LogglyFormat)
     );
};

log {
        source(s_src);
        destination(d_loggly);
};

```

**Comment by mochrul** [comment]
A TCP connection is a two way communication. And the fin from the server side does not mean that the connection is closed, just that the server do not want talk to me after that packet. But that d not prevent me to continue talking with them. On the other side, if you look the packets closely, you can see that the syslog (to be honest, the kernel of the machine where the syslog run) sends the same packet again and again. This is because the server neither acks the packet nor sends back a reset packet. The latter one is to signal the client that the connection is broken. Until that it can be a lot of things and the built-in mechanism of the tcpip will retry sending the packet.

Becomes of this, I think the syslog-ng cannot do too many things to prevent this. What I can suggest is three things.

1. Use large enough buffer to cope with this time frame
2. Check why the server remains silent when the ip address is changed/ why it changes the ip address.
3. Use TCP keepalive to lower this time frame

**Comment by MrAnno** [comment]
Closing due to inactivity.

**Comment by prajitdas** [comment]
Hi, I am facing this issue on Syslog-NG version 3.7.3 Does anyone have any resolution for this?
